-- Copyright (C) 2026 Intel Corporation
-- SPDX-License-Identifier: PostgreSQL
-- Table shape, including both triggers' declared firing conditions
\d vamana_databases
                Table "public.vamana_databases"
       Column       |  Type   | Collation | Nullable | Default 
--------------------+---------+-----------+----------+---------
 datname            | name    |           | not null | 
 enabled            | boolean |           | not null | true
 restart_generation | bigint  |           | not null | 0
 graph_memory_mb    | integer |           |          | 
 total_memory_mb    | integer |           |          | 
 search_num_threads | integer |           |          | 
Indexes:
    "vamana_databases_pkey" PRIMARY KEY, btree (datname)
Check constraints:
    "vamana_databases_graph_memory_mb_check" CHECK (graph_memory_mb > 0)
    "vamana_databases_search_num_threads_check" CHECK (search_num_threads >= 1 AND search_num_threads <= 1024)
    "vamana_databases_total_memory_mb_check" CHECK (total_memory_mb > 0)
Triggers:
    vamana_databases_changed AFTER INSERT OR DELETE OR UPDATE ON vamana_databases FOR EACH STATEMENT EXECUTE FUNCTION vamana_databases_notify()
    vamana_databases_queue_reservation AFTER INSERT OR UPDATE ON vamana_databases FOR EACH ROW EXECUTE FUNCTION vamana_databases_queue_reservation()
    vamana_databases_reject_delete_with_live_indexes BEFORE DELETE ON vamana_databases FOR EACH ROW EXECUTE FUNCTION vamana_databases_reject_delete_with_live_indexes()

-- The row-level trigger resolves datname against pg_database, so every row
-- here must name a database that actually exists.
CREATE DATABASE vamana_databases_test_dbc;
CREATE DATABASE vamana_databases_test_dbd;
CREATE DATABASE vamana_databases_test_dbe;
-- A nonexistent database is rejected outright, before any row is queued.
INSERT INTO vamana_databases (datname) VALUES ('vamana_databases_test_missing');
ERROR:  database "vamana_databases_test_missing" does not exist
-- INSERT/UPDATE/DELETE succeed; the row-level trigger is declared AFTER
-- INSERT OR UPDATE only, so DELETE below cannot invoke it.
INSERT INTO vamana_databases (datname)
	VALUES ('template1'), ('postgres'), ('vamana_databases_test_dbc');
UPDATE vamana_databases SET enabled = false
	WHERE datname IN ('template1', 'postgres', 'vamana_databases_test_dbc');
DELETE FROM vamana_databases WHERE datname = 'template1';
-- Placeholder columns accept NULL and non-NULL values
INSERT INTO vamana_databases (datname) VALUES ('vamana_databases_test_dbd');
INSERT INTO vamana_databases (datname, graph_memory_mb, total_memory_mb, search_num_threads)
	VALUES ('vamana_databases_test_dbe', 512, 4096, 8);
SELECT datname, graph_memory_mb, total_memory_mb, search_num_threads
	FROM vamana_databases ORDER BY datname;
          datname          | graph_memory_mb | total_memory_mb | search_num_threads 
---------------------------+-----------------+-----------------+--------------------
 postgres                  |                 |                 |                   
 vamana_databases_test_dbc |                 |                 |                   
 vamana_databases_test_dbd |                 |                 |                   
 vamana_databases_test_dbe |             512 |            4096 |                  8
(4 rows)

-- INSERT/UPDATE/DELETE/TRUNCATE are all revoked from PUBLIC; the table owner
-- retains them
CREATE ROLE vamana_databases_test_nonowner NOLOGIN;
SET ROLE vamana_databases_test_nonowner;
INSERT INTO vamana_databases (datname) VALUES ('postgres');
ERROR:  permission denied for table vamana_databases
UPDATE vamana_databases SET enabled = false WHERE datname = 'postgres';
ERROR:  permission denied for table vamana_databases
DELETE FROM vamana_databases WHERE datname = 'postgres';
ERROR:  permission denied for table vamana_databases
TRUNCATE vamana_databases;
ERROR:  permission denied for table vamana_databases
RESET ROLE;
DROP ROLE vamana_databases_test_nonowner;
TRUNCATE vamana_databases;
SELECT count(*) FROM vamana_databases;
 count 
-------
     0
(1 row)

DROP DATABASE vamana_databases_test_dbc;
DROP DATABASE vamana_databases_test_dbd;
DROP DATABASE vamana_databases_test_dbe;
-- Enable this database for the remaining regression files, which share this
-- one contrib_regression database and build vamana indexes.  The launcher
-- reserves the slot at COMMIT and spawns the worker; the first search then
-- waits for it via VamanaWorkerWaitUntilAvailable.
INSERT INTO vamana_databases (datname, enabled) VALUES ('contrib_regression', true);
-- Live-index counter is commit-accurate.  The BEFORE DELETE guard reads
-- indexCount as a hard gate, so it must equal committed catalog truth and
-- must not reflect a rolled-back CREATE/DROP INDEX.  pg_stat_vamana_worker is
-- cross-database, so each query filters to this database's slot; index_count is
-- uniform across a database's slots, so SELECT DISTINCT then yields one row.
CREATE TABLE vamana_counter_t (id serial PRIMARY KEY, val vector(3));
INSERT INTO vamana_counter_t (val) VALUES ('[0,0,0]'), ('[1,1,1]');
SET client_min_messages = error;
-- Counter tracks a committed CREATE then DROP.
CREATE INDEX vamana_counter_i ON vamana_counter_t USING vamana (val vector_l2_ops);
SELECT DISTINCT index_count FROM pg_stat_vamana_worker
	WHERE db_oid = (SELECT oid FROM pg_database WHERE datname = current_database());
 index_count 
-------------
           1
(1 row)

DROP INDEX vamana_counter_i;
SELECT DISTINCT index_count FROM pg_stat_vamana_worker
	WHERE db_oid = (SELECT oid FROM pg_database WHERE datname = current_database());
 index_count 
-------------
           0
(1 row)

-- Aborted DROP does not under-count: the index is back, the count still reflects it.
CREATE INDEX vamana_counter_i ON vamana_counter_t USING vamana (val vector_l2_ops);
BEGIN;
DROP INDEX vamana_counter_i;
ROLLBACK;
SELECT DISTINCT index_count FROM pg_stat_vamana_worker
	WHERE db_oid = (SELECT oid FROM pg_database WHERE datname = current_database());
 index_count 
-------------
           1
(1 row)

-- Aborted CREATE does not over-count.
BEGIN;
CREATE INDEX vamana_counter_i2 ON vamana_counter_t USING vamana (val vector_l2_ops);
ROLLBACK;
SELECT DISTINCT index_count FROM pg_stat_vamana_worker
	WHERE db_oid = (SELECT oid FROM pg_database WHERE datname = current_database());
 index_count 
-------------
           1
(1 row)

-- ROLLBACK TO SAVEPOINT discards only that subtransaction's delta.
BEGIN;
SAVEPOINT sp;
DROP INDEX vamana_counter_i;
ROLLBACK TO SAVEPOINT sp;
COMMIT;
SELECT DISTINCT index_count FROM pg_stat_vamana_worker
	WHERE db_oid = (SELECT oid FROM pg_database WHERE datname = current_database());
 index_count 
-------------
           1
(1 row)

-- A released savepoint's delta commits exactly once.
BEGIN;
SAVEPOINT sp;
DROP INDEX vamana_counter_i;
RELEASE SAVEPOINT sp;
COMMIT;
SELECT DISTINCT index_count FROM pg_stat_vamana_worker
	WHERE db_oid = (SELECT oid FROM pg_database WHERE datname = current_database());
 index_count 
-------------
           0
(1 row)

-- A savepoint released into its parent, then discarded by a rollback to an
-- earlier ancestor, must not commit its delta. Nothing new exists after
-- COMMIT, so the count must stay at 0.
BEGIN;
SAVEPOINT outer_sp;
SAVEPOINT inner_sp;
CREATE INDEX vamana_counter_nested ON vamana_counter_t USING vamana (val vector_l2_ops);
RELEASE SAVEPOINT inner_sp;
ROLLBACK TO SAVEPOINT outer_sp;
COMMIT;
SELECT DISTINCT index_count FROM pg_stat_vamana_worker
	WHERE db_oid = (SELECT oid FROM pg_database WHERE datname = current_database());
 index_count 
-------------
           0
(1 row)

-- Counter moves only on CREATE/DROP, never on a bare rebuild.  REINDEX and
-- TRUNCATE both re-run the build with no create or drop, and REINDEX
-- CONCURRENTLY builds a transient index then drops the old one; none may shift
-- the count.  It must equal committed catalog truth for the BEFORE DELETE guard.
CREATE INDEX vamana_counter_i ON vamana_counter_t USING vamana (val vector_l2_ops);
REINDEX INDEX vamana_counter_i;
TRUNCATE vamana_counter_t;
REINDEX INDEX CONCURRENTLY vamana_counter_i;
SELECT DISTINCT index_count FROM pg_stat_vamana_worker
	WHERE db_oid = (SELECT oid FROM pg_database WHERE datname = current_database());
 index_count 
-------------
           1
(1 row)

DROP INDEX vamana_counter_i;
SELECT DISTINCT index_count FROM pg_stat_vamana_worker
	WHERE db_oid = (SELECT oid FROM pg_database WHERE datname = current_database());
 index_count 
-------------
           0
(1 row)

RESET client_min_messages;
DROP TABLE vamana_counter_t;
-- svs_teardown_database() drops every vamana index the caller owns, reporting
-- one row per index.  A count of live vamana indexes in this database, so the
-- teardown cases can assert against "nothing left" without ordering assumptions.
CREATE VIEW vamana_live_indexes AS
	SELECT count(*) AS n
	FROM pg_class c JOIN pg_am a ON a.oid = c.relam
	WHERE a.amname = 'vamana' AND c.relkind = 'i';
CREATE TABLE vamana_td_a (id int, val vector(3));
CREATE TABLE vamana_td_b (id int, val vector(3));
INSERT INTO vamana_td_a VALUES (1, '[1,1,1]');
INSERT INTO vamana_td_b VALUES (1, '[1,1,1]');
SET client_min_messages = error;
CREATE INDEX vamana_td_ia ON vamana_td_a USING vamana (val vector_l2_ops);
CREATE INDEX vamana_td_ib ON vamana_td_b USING vamana (val vector_l2_ops);
RESET client_min_messages;
-- All indexes owned by the caller: each dropped, no reason, nothing left.
SELECT index_name, dropped, reason FROM svs_teardown_database() ORDER BY index_name;
     index_name      | dropped | reason 
---------------------+---------+--------
 public.vamana_td_ia | t       | 
 public.vamana_td_ib | t       | 
(2 rows)

SELECT n FROM vamana_live_indexes;
 n 
---
 0
(1 row)

-- Mixed ownership: the caller owns only some indexes.  Owned indexes drop;
-- unowned ones report dropped=false with the ownership error, and the call
-- continues rather than aborting on the first failure — which also proves the
-- function is not SECURITY DEFINER (drops run with the caller's privileges).
-- The caller owns one of the two indexes, so a caught error and a successful
-- drop both occur in one call: the surviving-unowned + dropped-owned result
-- proves the loop recovered memory context and resource owner after the
-- subtransaction rollback and continued.
CREATE ROLE vamana_td_other;
CREATE ROLE vamana_td_caller;
CREATE TABLE vamana_td_c (id int, val vector(3));
CREATE TABLE vamana_td_d (id int, val vector(3));
INSERT INTO vamana_td_c VALUES (1, '[1,1,1]');
INSERT INTO vamana_td_d VALUES (1, '[1,1,1]');
SET client_min_messages = error;
CREATE INDEX vamana_td_ic ON vamana_td_c USING vamana (val vector_l2_ops);
CREATE INDEX vamana_td_id ON vamana_td_d USING vamana (val vector_l2_ops);
RESET client_min_messages;
ALTER TABLE vamana_td_c OWNER TO vamana_td_other;
ALTER TABLE vamana_td_d OWNER TO vamana_td_caller;
SET ROLE vamana_td_caller;
SELECT index_name, dropped, reason FROM svs_teardown_database() ORDER BY index_name;
WARNING:  svs_teardown_database: could not drop index public.vamana_td_ic: must be owner of index vamana_td_ic
     index_name      | dropped |               reason                
---------------------+---------+-------------------------------------
 public.vamana_td_ic | f       | must be owner of index vamana_td_ic
 public.vamana_td_id | t       | 
(2 rows)

RESET ROLE;
-- The owned index is gone; the unowned one survives.
SELECT n FROM vamana_live_indexes;
 n 
---
 1
(1 row)

DROP TABLE vamana_td_c;			-- removes the surviving unowned index
DROP TABLE vamana_td_a, vamana_td_b, vamana_td_d;
DROP ROLE vamana_td_other, vamana_td_caller;
-- Already-clean database: teardown returns zero rows without error.
SELECT * FROM svs_teardown_database();
 index_relid | index_name | dropped | reason 
-------------+------------+---------+--------
(0 rows)

-- svs_warmup_index/svs_warmup_database gate on SELECT on the index's table
-- (same policy as pg_prewarm): warming only makes the index resident, no more
-- sensitive than reading it.  Contrast svs_teardown_database above, which gates
-- on ownership because it drops.
CREATE ROLE vamana_warm_reader;
CREATE TABLE vamana_warm_a (id int, val vector(3));
CREATE TABLE vamana_warm_b (id int, val vector(3));
INSERT INTO vamana_warm_a VALUES (1, '[1,1,1]');
INSERT INTO vamana_warm_b VALUES (1, '[1,1,1]');
SET client_min_messages = error;
CREATE INDEX vamana_warm_ia ON vamana_warm_a USING vamana (val vector_l2_ops);
CREATE INDEX vamana_warm_ib ON vamana_warm_b USING vamana (val vector_l2_ops);
RESET client_min_messages;
-- The table owner may warm its index.
SELECT svs_warmup_index('vamana_warm_ia');
 svs_warmup_index 
------------------
 
(1 row)

-- A role is granted SELECT on vamana_warm_a only: it may warm that index, but
-- warming vamana_warm_ib is denied, not silently skipped.
GRANT SELECT ON vamana_warm_a TO vamana_warm_reader;
SET ROLE vamana_warm_reader;
SELECT svs_warmup_index('vamana_warm_ia');
 svs_warmup_index 
------------------
 
(1 row)

SELECT svs_warmup_index('vamana_warm_ib');
ERROR:  permission denied for index vamana_warm_ib
RESET ROLE;
-- svs_warmup_database warms exactly the vamana indexes the caller may read and
-- skips the rest silently, so the count equals the caller's readable count
-- however many exist: vamana_warm_reader reads vamana_warm_a but not _b.
SET ROLE vamana_warm_reader;
SELECT svs_warmup_database() =
	(SELECT count(*) FROM pg_index i
	   JOIN pg_class ic ON ic.oid = i.indexrelid
	   JOIN pg_am am ON am.oid = ic.relam
	  WHERE am.amname = 'vamana'
	    AND has_table_privilege(i.indrelid, 'SELECT')) AS warms_only_readable;
 warms_only_readable 
---------------------
 t
(1 row)

RESET ROLE;
DROP TABLE vamana_warm_a, vamana_warm_b;
DROP ROLE vamana_warm_reader;
-- BEFORE DELETE guard: a row cannot be removed while vamana indexes still
-- exist in its database, reading the committed index count from shmem.
CREATE TABLE vamana_gate_t (id int, val vector(3));
INSERT INTO vamana_gate_t VALUES (1, '[1,1,1]');
SET client_min_messages = error;
CREATE INDEX vamana_gate_i ON vamana_gate_t USING vamana (val vector_l2_ops);
RESET client_min_messages;
-- Rejected while the index exists; the row is untouched.
DELETE FROM vamana_databases WHERE datname = current_database();
ERROR:  cannot remove "contrib_regression" from vamana_databases: 1 vamana index(es) still exist in that database
HINT:  run svs_teardown_database() in "contrib_regression" first
SELECT count(*) FROM vamana_databases WHERE datname = current_database();
 count 
-------
     1
(1 row)

-- After teardown the count is zero, so the same DELETE is allowed.  Rolled
-- back to keep this database enabled for the remaining regression files.
SELECT dropped FROM svs_teardown_database();
 dropped 
---------
 t
(1 row)

SELECT DISTINCT index_count FROM pg_stat_vamana_worker
	WHERE db_oid = (SELECT oid FROM pg_database WHERE datname = current_database());
 index_count 
-------------
           0
(1 row)

BEGIN;
DELETE FROM vamana_databases WHERE datname = current_database();
ROLLBACK;
DROP TABLE vamana_gate_t;
-- A row whose database was dropped without cleanup is deletable: the guard
-- tolerates the missing database and allows the DELETE.
CREATE DATABASE vamana_gate_gone;
INSERT INTO vamana_databases (datname, enabled) VALUES ('vamana_gate_gone', false);
DROP DATABASE vamana_gate_gone;
DELETE FROM vamana_databases WHERE datname = 'vamana_gate_gone';
DROP VIEW vamana_live_indexes;
